,id,key,name,title,blurb,tags,partype,attack,defense,magic,difficulty,hp,hpperlevel,mp,mpperlevel,movespeed,armor,armorperlevel,spellblock,spellblockperlevel,attackrange,hpregen,hpregenperlevel,mpregen,mpregenperlevel,crit,critperlevel,attackdamage,attackdamageperlevel,attackspeedperlevel,attackspeed,lane,Second lane,,18Health,18HealthRegen,18AttackSpeed,18AttackDamage,18Armor,18Spellblock
0,Aatrox,266,Aatrox,the Darkin Blade,"Once honored defenders of Shurima against the Void, Aatrox and his brethren would eventually become an even greater threat to Runeterra, and were defeated only by cunning mortal sorcery. But after centuries of imprisonment, Aatrox was the first to find...","['Fighter', 'Tank']",Blood Well,8,4,3,4,580,90,0,0,345,38,3.25,32.1,1.25,175,3,1,0,0,0,0,60,5,2.5,0.651,Top,Mid,,2110,20,0.927675,145,93.25,53.35
1,Ahri,103,Ahri,the Nine-Tailed Fox,"Innately connected to the latent power of Runeterra, Ahri is a vastaya who can reshape magic into orbs of raw energy. She revels in toying with her prey by manipulating their emotions before devouring their life essence. Despite her predatory nature...","['Mage', 'Assassin']",Mana,3,4,8,5,526,92,418,25,330,20.88,3.5,30,0.5,550,5.5,0.6,8,0.8,0,0,53.04,3,2,0.668,Mid,,,2090,15.7,0.89512,104.04,80.38,38.5
2,Akali,84,Akali,the Rogue Assassin,"Abandoning the Kinkou Order and her title of the Fist of Shadow, Akali now strikes alone, ready to be the deadly weapon her people need. Though she holds onto all she learned from her master Shen, she has pledged to defend Ionia from its enemies, one...",['Assassin'],Energy,5,3,8,7,575,95,200,0,345,23,3.5,37,1.25,125,8,0.5,50,0,0,0,62.4,3.3,3.2,0.625,Mid,Top,,2190,16.5,0.965,118.5,82.5,58.25
3,Alistar,12,Alistar,the Minotaur,"Always a mighty warrior with a fearsome reputation, Alistar seeks revenge for the death of his clan at the hands of the Noxian empire. Though he was enslaved and forced into the life of a gladiator, his unbreakable will was what kept him from truly...","['Tank', 'Support']",Mana,6,9,5,7,600,106,350,40,330,44,3.5,32.1,1.25,125,8.5,0.85,8.5,0.8,0,0,62,3.75,2.125,0.625,Sup,,,2402,22.95,0.85078125,125.75,103.5,53.35
4,Amumu,32,Amumu,the Sad Mummy,"Legend claims that Amumu is a lonely and melancholy soul from ancient Shurima, roaming the world in search of a friend. Doomed by an ancient curse to remain alone forever, his touch is death, his affection ruin. Those who claim to have seen him describe...","['Tank', 'Mage']",Mana,2,6,8,3,613.12,84,287.2,40,335,33,3.8,32.1,1.25,125,9,0.85,7.382,0.525,0,0,53.38,3.8,2.18,0.736,Jg,,,2041.12,23.45,1.0087616,117.98,97.6,53.35
5,Anivia,34,Anivia,the Cryophoenix,"Anivia is a benevolent winged spirit who endures endless cycles of life, death, and rebirth to protect the Freljord. A demigod born of unforgiving ice and bitter winds, she wields those elemental powers to thwart any who dare disturb her homeland...","['Mage', 'Support']",Mana,1,4,10,10,480,82,495,25,325,21.22,4,30,0.5,600,5.5,0.55,8,0.8,0,0,51.376,3.2,1.68,0.625,Mid,,,1874,14.85,0.8035,105.776,89.22,38.5
6,Annie,1,Annie,the Dark Child,"Dangerous, yet disarmingly precocious, Annie is a child mage with immense pyromantic power. Even in the shadows of the mountains north of Noxus, she is a magical outlier. Her natural affinity for fire manifested early in life through unpredictable...",['Mage'],Mana,2,3,10,6,524,88,418,25,335,19.22,4,30,0.5,625,5.5,0.55,8,0.8,0,0,50.41,2.625,1.36,0.579,Sup,Mid,,2020,14.85,0.7128648,95.035,87.22,38.5
7,Aphelios,523,Aphelios,the Weapon of the Faithful,"Emerging from moonlight's shadow with weapons drawn, Aphelios kills the enemies of his faith in brooding silence?”speaking only through the certainty of his aim, and the firing of each gun. Though fueled by a poison that renders him mute, he is guided by...",['Marksman'],Mana,6,2,1,10,530,88,348,42,325,28,3,26,0.5,550,3.25,0.55,6.5,0.4,0,0,57,2.4,2.1,0.64,Bot,,,2026,12.6,0.86848,97.8,79,34.5
8,Ashe,22,Ashe,the Frost Archer,"Iceborn warmother of the Avarosan tribe, Ashe commands the most populous horde in the north. Stoic, intelligent, and idealistic, yet uncomfortable with her role as leader, she taps into the ancestral magics of her lineage to wield a bow of True Ice...","['Marksman', 'Support']",Mana,7,3,2,4,570,87,280,32,325,26,3.4,30,0.5,600,3.5,0.55,6.972,0.4,0,0,59,2.96,3.33,0.658,Bot,,,2049,12.85,1.0304938,109.32,83.8,38.5
9,AurelionSol,136,Aurelion Sol,The Star Forger,"Aurelion Sol once graced the vast emptiness of the cosmos with celestial wonders of his own devising. Now, he is forced to wield his awesome power at the behest of a space-faring empire that tricked him into servitude. Desiring a return to his...",['Mage'],Mana,2,3,8,7,575,92,350,50,325,19,3.6,30,0.5,550,7,0.6,6,0.8,0,0,57,3.2,1.36,0.625,Mid,,,2139,17.2,0.7695,111.4,80.2,38.5
10,Azir,268,Azir,the Emperor of the Sands,"Azir was a mortal emperor of Shurima in a far distant age, a proud man who stood at the cusp of immortality. His hubris saw him betrayed and murdered at the moment of his greatest triumph, but now, millennia later, he has been reborn as an Ascended...","['Mage', 'Marksman']",Mana,6,3,8,9,552,92,480,21,335,19.04,3,30,0.5,525,7,0.75,8,0.8,0,0,52,2.8,3,0.625,Mid,,,2116,19.75,0.94375,99.6,70.04,38.5
11,Bard,432,Bard,the Wandering Caretaker,"A traveler from beyond the stars, Bard is an agent of serendipity who fights to maintain a balance where life can endure the indifference of chaos. Many Runeterrans sing songs that ponder his extraordinary nature, yet they all agree that the cosmic...","['Support', 'Mage']",Mana,4,4,5,9,560,89,350,50,330,34,4,30,0.5,500,5.5,0.55,6,0.45,0,0,52,3,2,0.625,Sup,,,2073,14.85,0.8375,103,102,38.5
12,Blitzcrank,53,Blitzcrank,the Great Steam Golem,"Blitzcrank is an enormous, near-indestructible automaton from Zaun, originally built to dispose of hazardous waste. However, he found this primary purpose too restricting, and modified his own form to better serve the fragile people of the Sump...","['Tank', 'Fighter']",Mana,4,8,5,4,582.6,95,267.2,40,325,37,3.5,32.1,1.25,125,8.5,0.75,8.5,0.8,0,0,61.54,3.5,1.13,0.625,Sup,,,2197.6,21.25,0.7450625,121.04,96.5,53.35
13,Brand,63,Brand,the Burning Vengeance,"Once a tribesman of the icy Freljord named Kegan Rodhe, the creature known as Brand is a lesson in the temptation of greater power. Seeking one of the legendary World Runes, Kegan betrayed his companions and seized it for himself?”and, in an instant, the...",['Mage'],Mana,2,2,9,4,519.68,88,469,21,340,21.88,3.5,30,0.5,550,5.5,0.55,10.665,0.6,0,0,57.04,3,1.36,0.625,Sup,Mid,,2015.68,14.85,0.7695,108.04,81.38,38.5
14,Braum,201,Braum,the Heart of the Freljord,"Blessed with massive biceps and an even bigger heart, Braum is a beloved hero of the Freljord. Every mead hall north of Frostheld toasts his legendary strength, said to have felled a forest of oaks in a single night, and punched an entire mountain into...","['Support', 'Tank']",Mana,3,9,4,3,540,98,310.6,45,335,47,4,32.1,1.25,125,8.5,1,6,0.8,0,0,55.376,3.2,3.5,0.644,Sup,,,2206,25.5,1.02718,109.776,115,53.35
15,Caitlyn,51,Caitlyn,the Sheriff of Piltover,"Renowned as its finest peacekeeper, Caitlyn is also Piltover's best shot at ridding the city of its elusive criminal elements. She is often paired with Vi, acting as a cool counterpoint to her partner's more impetuous nature. Even though she carries a...",['Marksman'],Mana,8,2,2,6,510,93,313.7,35,325,28,3.5,30,0.5,650,3.5,0.55,7.4,0.55,0,0,62,2.88,3.5,0.681,Bot,,,2091,12.85,1.086195,110.96,87.5,38.5
16,Camille,164,Camille,the Steel Shadow,"Weaponized to operate outside the boundaries of the law, Camille is the Principal Intelligencer of Clan Ferros?”an elegant and elite agent who ensures the Piltover machine and its Zaunite underbelly runs smoothly. Adaptable and precise, she views sloppy...","['Fighter', 'Tank']",Mana,8,6,3,4,575.6,85,338.8,32,340,35,3.8,32.1,1.25,125,8.5,0.8,8.15,0.75,0,0,68,3.5,2.5,0.644,Top,,,2020.6,22.1,0.9177,127.5,99.6,53.35
17,Cassiopeia,69,Cassiopeia,the Serpent's Embrace,"Cassiopeia is a deadly creature bent on manipulating others to her sinister will. Youngest and most beautiful daughter of the noble Du Couteau family of Noxus, she ventured deep into the crypts beneath Shurima in search of ancient power. There, she was...",['Mage'],Mana,2,3,9,10,560,90,350,40,328,18,3.5,32,0.5,550,5.5,0.5,8,0.8,0,0,53,3,1.5,0.647,Mid,Top,,2090,14,0.811985,104,77.5,40.5
18,Chogath,31,Cho'Gath,the Terror of the Void,"From the moment Cho'Gath first emerged into the harsh light of Runeterra's sun, the beast was driven by the most pure and insatiable hunger. A perfect expression of the Void's desire to consume all life, Cho'Gath's complex biology quickly converts...","['Tank', 'Mage']",Mana,3,7,7,5,574.4,80,272.2,40,345,38,3.5,32.1,1.25,125,9,0.85,7.206,0.45,0,0,69,4.2,1.44,0.625,Top,,,1934.4,23.45,0.778,140.4,97.5,53.35
19,Corki,42,Corki,the Daring Bombardier,"The yordle pilot Corki loves two things above all others: flying, and his glamorous mustache... though not necessarily in that order. After leaving Bandle City, he settled in Piltover and fell in love with the wondrous machines he found there. He...",['Marksman'],Mana,8,3,6,6,518,87,350.16,34,325,28,3.5,30,0.5,550,5.5,0.55,7.424,0.55,0,0,55,2.5,2.3,0.638,Mid,,,1997,14.85,0.887458,97.5,87.5,38.5
20,Darius,122,Darius,the Hand of Noxus,"There is no greater symbol of Noxian might than Darius, the nation's most feared and battle-hardened commander. Rising from humble origins to become the Hand of Noxus, he cleaves through the empire's enemies?”many of them Noxians themselves. Knowing that...","['Fighter', 'Tank']",Mana,9,5,1,2,582.24,100,263,37.5,340,39,4,32.1,1.25,175,10,0.95,6.6,0.35,0,0,64,5,1,0.625,Top,,,2282.24,26.15,0.73125,149,107,53.35
21,Diana,131,Diana,Scorn of the Moon,"Bearing her crescent moonblade, Diana fights as a warrior of the Lunari?”a faith all but quashed in the lands around Mount Targon. Clad in shimmering armor the color of winter snow at night, she is a living embodiment of the silver moon's power. Imbued...","['Fighter', 'Mage']",Mana,7,6,8,4,570,95,375,25,345,31,3.6,32.1,1.25,150,7.5,0.85,8,0.8,0,0,57,3,2.25,0.625,Mid,,,2185,21.95,0.8640625,108,92.2,53.35
22,DrMundo,36,Dr. Mundo,the Madman of Zaun,"Utterly insane, unrepentantly homicidal, and horrifyingly purple, Dr. Mundo is what keeps many of Zaun's citizens indoors on particularly dark nights. This monosyllabic monstrosity seems to want nothing more than pain?”both the giving of it, and the...","['Fighter', 'Tank']",None,5,7,6,5,582.52,89,0,0,345,36,3.5,32.1,1.25,125,8,0.75,0,0,0,0,61.27,3.5,2.8,0.721,Top,,,2095.52,20.75,1.064196,120.77,95.5,53.35
23,Draven,119,Draven,the Glorious Executioner,"In Noxus, warriors known as Reckoners face one another in arenas where blood is spilled and strength tested?”but none has ever been as celebrated as Draven. A former soldier, he found that the crowds uniquely appreciated his flair for the dramatic, and...",['Marksman'],Mana,9,3,1,8,605,90,360.56,39,330,29,3.3,30,0.5,550,3.75,0.7,8.042,0.65,0,0,60,3.61,2.7,0.679,Bot,,,2135,15.65,0.990661,121.37,85.1,38.5
24,Ekko,245,Ekko,the Boy Who Shattered Time,"A prodigy from the rough streets of Zaun, Ekko manipulates time to twist any situation to his advantage. Using his own invention, the Zero Drive, he explores the branching possibilities of reality to craft the perfect moment. Though he revels in this...","['Assassin', 'Fighter']",Mana,5,3,7,8,585,85,280,50,340,32,3,32,1.25,125,9,0.9,7,0.8,0,0,58,3,3.3,0.688,Jg,Mid,,2030,24.3,1.073968,109,83,53.25
25,Elise,60,Elise,the Spider Queen,"Elise is a deadly predator who dwells in a shuttered, lightless palace, deep within the oldest city of Noxus. Once mortal, she was the mistress of a powerful house, but the bite of a vile demigod transformed her into something beautiful, yet utterly...","['Mage', 'Fighter']",Mana,6,5,7,9,534,93,324,50,330,27,3.35,30,0.5,550,5.5,0.6,6,0.8,0,0,55,3,1.75,0.625,Jg,,,2115,15.7,0.8109375,106,83.95,38.5
26,Evelynn,28,Evelynn,Agony's Embrace,"Within the dark seams of Runeterra, the demon Evelynn searches for her next victim. She lures in prey with the voluptuous faÃ§ade of a human female, but once a person succumbs to her charms, Evelynn's true form is unleashed. She then subjects her victim...","['Assassin', 'Mage']",Mana,4,2,7,10,572,84,315.6,42,335,37,3.5,32.1,1.25,125,8.5,0.75,8.108,0.6,0,0,61,3,2.1,0.667,Jg,,,2000,21.25,0.905119,112,96.5,53.35
27,Ezreal,81,Ezreal,the Prodigal Explorer,"A dashing adventurer, unknowingly gifted in the magical arts, Ezreal raids long-lost catacombs, tangles with ancient curses, and overcomes seemingly impossible odds with ease. His courage and bravado knowing no bounds, he prefers to improvise his way...","['Marksman', 'Mage']",Mana,7,2,6,7,530,88,375,50,325,22,3.5,30,0.5,550,4,0.55,8.5,0.65,0,0,60,2.5,2.5,0.625,Bot,,,2026,13.35,0.890625,102.5,81.5,38.5
28,Fiddlesticks,9,Fiddlesticks,the Ancient Fear,"Something has awoken in Runeterra. Something ancient. Something terrible. The ageless horror known as Fiddlesticks stalks the edges of mortal society, drawn to areas thick with paranoia where it feeds upon terrorized victims. Wielding a jagged scythe...","['Mage', 'Support']",Mana,2,3,9,9,580.4,92,500,28,335,34,3.5,30,0.5,480,5.5,0.6,8,0.8,0,0,55.36,2.625,2.11,0.625,Jg,,,2144.4,15.7,0.8491875,99.985,93.5,38.5
29,Fiora,114,Fiora,the Grand Duelist,"The most feared duelist in all Valoran, Fiora is as renowned for her brusque manner and cunning mind as she is for the speed of her bluesteel rapier. Born to House Laurent in the kingdom of Demacia, Fiora took control of the family from her father in...","['Fighter', 'Assassin']",Mana,10,4,2,3,550,85,300,40,345,33,3.5,32.1,1.25,150,8.5,0.55,8,0.7,0,0,68,3.3,3.2,0.69,Top,,,1995,17.85,1.06536,124.1,92.5,53.35
30,Fizz,105,Fizz,the Tidal Trickster,"Fizz is an amphibious yordle, who dwells among the reefs surrounding Bilgewater. He often retrieves and returns the tithes cast into the sea by superstitious captains, but even the saltiest of sailors know better than to cross him?”for many are the tales...","['Assassin', 'Fighter']",Mana,6,4,7,6,570,98,317.2,37,335,22.412,3.4,32.1,1.25,175,8,0.7,6,0.8,0,0,58.04,3,3.1,0.658,Mid,,,2236,19.9,1.004766,109.04,80.212,53.35
31,Galio,3,Galio,the Colossus,"Outside the gleaming city of Demacia, the stone colossus Galio keeps vigilant watch. Built as a bulwark against enemy mages, he often stands motionless for decades until the presence of powerful magic stirs him to life. Once activated, Galio makes the...","['Tank', 'Mage']",Mana,1,10,6,5,562,112,500,40,335,24,3.5,32,1.25,150,8,0.8,9.5,0.7,0,0,59,3.5,1.5,0.625,Mid,Sup,,2466,21.6,0.784375,118.5,83.5,53.25
32,Gangplank,41,Gangplank,the Saltwater Scourge,"As unpredictable as he is brutal, the dethroned reaver king Gangplank is feared far and wide. Once, he ruled the port city of Bilgewater, and while his reign is over, there are those who believe this has only made him more dangerous. Gangplank would see...",['Fighter'],Mana,7,6,4,9,540,82,282,40,345,35,3,32.1,1.25,125,6,0.6,7.5,0.7,0,0,64,3,3.2,0.658,Top,,,1934,16.2,1.015952,115,86,53.35
33,Garen,86,Garen,The Might of Demacia,"A proud and noble warrior, Garen fights as one of the Dauntless Vanguard. He is popular among his fellows, and respected well enough by his enemies?”not least as a scion of the prestigious Crownguard family, entrusted with defending Demacia and its...","['Fighter', 'Tank']",None,7,7,1,5,620,84,0,0,340,36,3,32.1,0.75,175,8,0.5,0,0,0,0,66,4.5,3.65,0.625,Top,Mid,,2048,16.5,1.0128125,142.5,87,44.85
34,Gnar,150,Gnar,the Missing Link,"Gnar is a primeval yordle whose playful antics can erupt into a toddler's outrage in an instant, transforming him into a massive beast bent on destruction. Frozen in True Ice for millennia, the curious creature broke free and now hops about a changed...","['Fighter', 'Tank']",Rage,6,5,5,8,510,65,100,0,335,32,2.5,30,0.5,175,4.5,1.75,0,0,0,0,59,3,6,0.625,Top,,,1615,34.25,1.2625,110,74.5,38.5
35,Gragas,79,Gragas,the Rabble Rouser,"Equal parts jolly and imposing, Gragas is a massive, rowdy brewmaster on his own quest for the perfect pint of ale. Hailing from parts unknown, he now searches for rare ingredients among the unblemished wastes of the Freljord, trying each recipe as he...","['Fighter', 'Mage']",Mana,4,7,6,5,600,95,400,47,330,38,3.6,32.1,1.25,125,5.5,0.5,6,0.8,0,0,64,3.5,2.05,0.675,Jg,,,2215,14,0.9102375,123.5,99.2,53.35
36,Graves,104,Graves,the Outlaw,"Malcolm Graves is a renowned mercenary, gambler, and thief?”a wanted man in every city and empire he has visited. Even though he has an explosive temper, he possesses a strict sense of criminal honor, often enforced at the business end of his...",['Marksman'],Mana,8,5,3,3,555,92,325,40,340,33,3.4,32,1.25,425,8,0.7,8,0.7,0,0,68,3,2.6,0.475,Jg,,,2119,19.9,0.68495,119,90.8,53.25
37,Hecarim,120,Hecarim,the Shadow of War,"Hecarim is a spectral fusion of man and beast, cursed to ride down the souls of the living for all eternity. When the Blessed Isles fell into shadow, this proud knight was obliterated by the destructive energies of the Ruination, along with all his...","['Fighter', 'Tank']",Mana,8,6,4,6,580,90,277.2,40,345,36,4,32.1,1.25,175,7,0.75,6.5,0.6,0,0,66,3.2,2.5,0.67,Jg,Top,,2110,19.75,0.95475,120.4,104,53.35
38,Heimerdinger,74,Heimerdinger,the Revered Inventor,"A brilliant yet eccentric yordle scientist, Professor Cecil B. Heimerdinger is one of the most innovative and esteemed inventors Piltover has ever known. Relentless in his work to the point of neurotic obsession, he thrives on answering the universe's...","['Mage', 'Support']",Mana,2,6,8,8,488,87,385,20,340,19.04,3,30,0.5,550,7,0.55,8,0.8,0,0,55.536,2.7,1.36,0.625,Top,,,1967,16.35,0.7695,101.436,70.04,38.5
39,Illaoi,420,Illaoi,the Kraken Priestess,"Illaoi's powerful physique is dwarfed only by her indomitable faith. As the prophet of the Great Kraken, she uses a huge, golden idol to rip her foes' spirits from their bodies and shatter their perception of reality. All who challenge the ?œTruth Bearer...","['Fighter', 'Tank']",Mana,8,6,3,4,585.6,95,300,40,340,35,3.8,32.1,1.25,125,9.5,0.8,7.5,0.75,0,0,68,5,2.5,0.571,Top,,,2200.6,23.1,0.813675,153,99.6,53.35
40,Irelia,39,Irelia,the Blade Dancer,"The Noxian occupation of Ionia produced many heroes, none more unlikely than young Irelia of Navori. Trained in the ancient dances of her province, she adapted her art for war, using the graceful and carefully practised movements to levitate a host of...","['Fighter', 'Assassin']",Mana,7,4,5,5,580,95,350,30,335,36,3,32,1.25,200,8.5,0.85,8,0.8,0,0,63,4,2.5,0.656,Top,Mid,,2195,22.95,0.9348,131,87,53.25
41,Ivern,427,Ivern,the Green Father,"Ivern Bramblefoot, known to many as the Green Father, is a peculiar half man, half tree who roams Runeterra's forests, cultivating life everywhere he goes. He knows the secrets of the natural world, and holds deep friendships with all things that grow...","['Support', 'Mage']",Mana,3,5,7,7,585,95,450,60,330,27,3.5,32.1,1.25,475,7,0.85,6,0.75,0,0,50,3,3.4,0.644,Jg,,,2200,21.45,1.016232,101,86.5,53.35
42,Janna,40,Janna,the Storm's Fury,"Armed with the power of Runeterra's gales, Janna is a mysterious, elemental wind spirit who protects the dispossessed of Zaun. Some believe she was brought into existence by the pleas of Runeterra's sailors who prayed for fair winds as they navigated...","['Support', 'Mage']",Mana,3,5,7,7,500,70,350,64,315,28,3.8,30,0.5,550,5.5,0.55,11.5,0.4,0,0,46,1.5,2.95,0.625,Sup,,,1690,14.85,0.9384375,71.5,92.6,38.5
43,JarvanIV,59,Jarvan IV,the Exemplar of Demacia,"Prince Jarvan, scion of the Lightshield dynasty, is heir apparent to the throne of Demacia. Raised to be a paragon of his nation's greatest virtues, he is forced to balance the heavy expectations placed upon him with his own desire to fight on the front...","['Tank', 'Fighter']",Mana,6,8,3,5,570,90,300,40,340,34,3.6,32.1,1.25,175,8,0.7,6.5,0.45,0,0,64,3.4,2.5,0.658,Jg,,,2100,19.9,0.93765,121.8,95.2,53.35
44,Jax,24,Jax,Grandmaster at Arms,"Unmatched in both his skill with unique armaments and his biting sarcasm, Jax is the last known weapons master of Icathia. After his homeland was laid low by its own hubris in unleashing the Void, Jax and his kind vowed to protect what little remained...","['Fighter', 'Assassin']",Mana,7,5,7,5,592.8,85,338.8,32,350,36,3,32.1,1.25,125,8.5,0.55,7.576,0.7,0,0,68,3.375,3.4,0.638,Top,Jg,,2037.8,17.85,1.006764,125.375,87,53.35
45,Jayce,126,Jayce,the Defender of Tomorrow,"Jayce is a brilliant inventor who has pledged his life to the defense of Piltover and its unyielding pursuit of progress. With his transforming hextech hammer in hand, Jayce uses his strength, courage, and considerable intelligence to protect his...","['Fighter', 'Marksman']",Mana,8,4,3,7,560,90,375,45,335,27,3.5,30,0.5,125,6,0.6,6,0.8,0,0,54,4.25,3,0.658,Top,Mid,,2090,16.2,0.99358,126.25,86.5,38.5
46,Jhin,202,Jhin,the Virtuoso,"Jhin is a meticulous criminal psychopath who believes murder is art. Once an Ionian prisoner, but freed by shadowy elements within Ionia's ruling council, the serial killer now works as their cabal's assassin. Using his gun as his paintbrush, Jhin...","['Marksman', 'Mage']",Mana,10,2,6,6,585,93,300,50,330,24,3.5,30,0.5,550,3.75,0.55,6,0.8,0,0,59,4.7,0,0.625,Bot,,,2166,13.1,0.625,138.9,83.5,38.5
47,Jinx,222,Jinx,the Loose Cannon,"A manic and impulsive criminal from Zaun, Jinx lives to wreak havoc without care for the consequences. With an arsenal of deadly weapons, she unleashes the loudest blasts and brightest explosions to leave a trail of mayhem and panic in her wake. Jinx...",['Marksman'],Mana,9,2,4,6,610,86,245,45,325,28,3.5,30,0.5,525,3.75,0.5,6.7,1,0,0,57,3.4,1,0.625,Bot,,,2072,12.25,0.73125,114.8,87.5,38.5
48,Kaisa,145,Kai'Sa,Daughter of the Void,"Claimed by the Void when she was only a child, Kai'Sa managed to survive through sheer tenacity and strength of will. Her experiences have made her a deadly hunter and, to some, the harbinger of a future they would rather not live to see. Having entered...",['Marksman'],Mana,8,5,3,6,600,88,344.88,38,335,28,3,30,0.5,525,3.5,0.55,8.2,0.45,0,0,59,2,1.8,0.644,Bot,,,2096,12.85,0.841064,93,79,38.5
49,Kalista,429,Kalista,the Spear of Vengeance,"A specter of wrath and retribution, Kalista is the undying spirit of vengeance, an armored nightmare summoned from the Shadow Isles to hunt deceivers and traitors. The betrayed may cry out in blood to be avenged, but Kalista only answers those willing...",['Marksman'],Mana,8,2,4,7,534,100,250,45,325,21,4,30,0.5,525,3.75,0.55,6.3,0.4,0,0,69,3.5,4,0.694,Bot,Top,,2234,13.1,1.16592,128.5,89,38.5
50,Karma,43,Karma,the Enlightened One,"No mortal exemplifies the spiritual traditions of Ionia more than Karma. She is the living embodiment of an ancient soul reincarnated countless times, carrying all her accumulated memories into each new life, and blessed with power that few can...","['Mage', 'Support']",Mana,1,7,8,5,534,95,374,50,335,26,3.8,30,0.5,525,5.5,0.55,11.5,0.5,0,0,53.544,3.3,2.3,0.625,Sup,,,2149,14.85,0.869375,109.644,90.6,38.5
51,Karthus,30,Karthus,the Deathsinger,"The harbinger of oblivion, Karthus is an undying spirit whose haunting songs are a prelude to the horror of his nightmarish appearance. The living fear the eternity of undeath, but Karthus sees only beauty and purity in its embrace, a perfect union of...",['Mage'],Mana,2,2,10,7,550,87,467,30.5,335,18,3.5,30,0.5,450,6.5,0.55,8,0.8,0,0,45.66,3.25,2.11,0.625,Jg,,,2029,15.85,0.8491875,100.91,77.5,38.5
52,Kassadin,38,Kassadin,the Void Walker,"Cutting a burning swath through the darkest places of the world, Kassadin knows his days are numbered. A widely traveled Shuriman guide and adventurer, he had chosen to raise a family among the peaceful southern tribes?”until the day his village was...","['Assassin', 'Mage']",Mana,3,5,8,8,576,90,397.6,67,335,19,2.8,30,0.5,150,6,0.5,6,0.8,0,0,58.852,3.9,3.7,0.64,Mid,,,2106,14.5,1.04256,125.152,66.6,38.5
53,Katarina,55,Katarina,the Sinister Blade,"Decisive in judgment and lethal in combat, Katarina is a Noxian assassin of the highest caliber. Eldest daughter to the legendary General Du Couteau, she made her talents known with swift kills against unsuspecting enemies. Her fiery ambition has driven...","['Assassin', 'Mage']",None,4,3,9,8,602,94,0,0,340,27.88,3.5,32.1,1.25,125,7.5,0.7,0,0,0,0,58,3.2,2.74,0.658,Mid,,,2200,19.4,0.9644964,112.4,87.38,53.35
54,Kayle,10,Kayle,the Righteous,"Born to a Targonian Aspect at the height of the Rune Wars, Kayle honored her mother's legacy by fighting for justice on wings of divine flame. She and her twin sister Morgana were the protectors of Demacia for many years?”until Kayle became disillusioned...","['Fighter', 'Support']",Mana,6,6,7,7,600,85,330,50,335,26,3,34,0.5,175,5,0.5,8,0.8,0,0,50,2.5,1.5,0.625,Top,,,2045,13.5,0.784375,92.5,77,42.5
55,Kayn,141,Kayn,the Shadow Reaper,"A peerless practitioner of lethal shadow magic, Shieda Kayn battles to achieve his true destiny?”to one day lead the Order of Shadow into a new era of Ionian supremacy. He wields the sentient darkin weapon Rhaast, undeterred by its creeping corruption of...","['Fighter', 'Assassin']",Mana,10,6,1,8,585,85,410,50,340,38,3.3,32.1,1.25,175,8,0.75,11.5,0.95,0,0,68,3.3,2.7,0.669,Jg,,,2030,20.75,0.976071,124.1,94.1,53.35
56,Kennen,85,Kennen,the Heart of the Tempest,"More than just the lightning-quick enforcer of Ionian balance, Kennen is the only yordle member of the Kinkou. Despite his small, furry stature, he is eager to take on any threat with a whirling storm of shuriken and boundless enthusiasm. Alongside his...","['Mage', 'Marksman']",Energy,6,4,7,4,541,84,200,0,335,29,3.75,30,0.5,550,5.5,0.65,50,0,0,0,48,3.75,3.4,0.625,Top,,,1969,16.55,0.98625,111.75,92.75,38.5
